{
  "packet_id": "HO-DET-011-CASE-PACKET-001",
  "packet_type": "platform_case_packet_guardrail",
  "detection_id": "HO-DET-011",
  "proof_ceiling": "TEST_VALIDATED_SYNTHETIC_SCOPE",
  "public_safe_status": "NOT_PUBLIC_SAFE",
  "promotion_status": "BLOCKED",
  "validation_result_ref": "hawkinsoperations-validation/reports/ho-det-011/validation-result.json",
  "validation_cases_ref": "hawkinsoperations-validation/validation/successor/ho-det-011/validation-cases.json",
  "validation_pr": "HawkinsOperations/hawkinsoperations-validation#25",
  "validation_merge_commit": "4c4bf5a",
  "validation_status": "pass",
  "synthetic_validation": true,
  "exact_claim_supported": "HO-DET-011 passed synthetic validation against controlled Windows service creation fixtures.",
  "runtime_active": false,
  "signal_observed": false,
  "evidence_linked_public_proof": false,
  "public_safe_runtime_proof": false,
  "production_ready": false,
  "fleet_wide": false,
  "live_splunk_fired": false,
  "wazuh_routed": false,
  "cribl_routed": false,
  "aws_live": false,
  "service_creation_coverage_complete": false,
  "ai_decided_disposition": false,
  "ai_may_approve": false,
  "ai_may_promote": false,
  "ai_may_close": false,
  "human_review_required": true,
  "telemetry_boundary": {
    "event_7045": "Windows System / Service Control Manager service-install telemetry",
    "event_4697": "Windows Security service installation auditing where available",
    "event_1": "Sysmon process creation context where available"
  },
  "validation_counts": {
    "total_cases": 6,
    "positive_cases": 3,
    "negative_cases": 3,
    "pass": 6,
    "fail": 0,
    "matched_positive_count": 3
  },
  "allowed_claims": [
    "HO-DET-011 source artifacts exist in the detections repository.",
    "HO-DET-011 passed synthetic validation against controlled Windows service creation fixtures.",
    "HO-DET-011 platform case-packet guardrail exists for synthetic-scope claim boundaries.",
    "HO-DET-011 remains capped at TEST_VALIDATED_SYNTHETIC_SCOPE."
  ],
  "blocked_claims": [
    "runtime-active",
    "signal-observed",
    "public-safe",
    "evidence-linked public proof",
    "live Splunk fired",
    "Wazuh-routed",
    "Cribl-routed",
    "AWS-live",
    "production-ready",
    "fleet-wide",
    "service-creation coverage completeness",
    "AI-approved disposition",
    "AI-closed disposition"
  ],
  "privacy_boundary": {
    "synthetic_fixtures_only": true,
    "local_private_paths_included": false,
    "hostnames_included": false,
    "lan_ips_included": false,
    "secret_material_included": false,
    "screenshots_included": false,
    "raw_runtime_evidence_included": false
  },
  "does_not_prove": [
    "runtime activity",
    "signal observation",
    "public-safe evidence",
    "production deployment",
    "fleet-wide coverage",
    "routing through Wazuh or Cribl",
    "AWS-live coverage",
    "complete service-creation coverage"
  ]
}
